[
    {
        "name": "",
        "alias": [""],
        "link": "",
        "desc": {},
        "open": {},
        "pics": {},
        "same": [],
        "coords": []
    },
    {
        "name": "",
        "alias": [""],
        "link": "",
        "desc": {},
        "open": {},
        "pics": {},
        "same": [],
        "coords": []
    }
]
